id,food_group_id,name,protein,fat,carbs,calories,water,fiber
11338,6,"Peppers, sweet, green, frozen, chopped, boiled, drained, without salt",0.95,0.18,3.9,18,94.7,0.9
11339,6,"Peppers, sweet, green, sauteed",0.78,11.85,4.22,127,82.65,1.8
11344,6,"Pigeonpeas, immature seeds, raw",7.2,1.64,23.88,136,65.88,5.1
11345,6,"Pigeonpeas, immature seeds, cooked, boiled, drained, without salt",5.96,1.36,19.49,111,71.8,4.2
11349,6,Poi,0.38,0.14,27.23,112,71.64,0.4
11350,6,"Pokeberry shoots, (poke), raw",2.6,0.4,3.7,23,91.6,1.7
11351,6,"Pokeberry shoots, (poke), cooked, boiled, drained, without salt",2.3,0.4,3.1,20,92.9,1.5
11352,6,"Potatoes, flesh and skin, raw",2.05,0.09,17.49,77,79.25,2.1
11353,6,"Potatoes, russet, flesh and skin, raw",2.14,0.08,18.07,79,78.58,1.3
11354,6,"Potatoes, white, flesh and skin, raw",1.68,0.1,15.71,69,81.58,2.4
11355,6,"Potatoes, red, flesh and skin, raw",1.89,0.14,15.9,70,80.96,1.7
11356,6,"Potatoes, Russet, flesh and skin, baked",2.63,0.13,21.44,97,74.45,2.3
11357,6,"Potatoes, white, flesh and skin, baked",2.1,0.15,21.08,94,75.43,2.1
11358,6,"Potatoes, red, flesh and skin, baked",2.3,0.15,19.59,89,76.67,1.8
11359,6,"Potatoes, french fried, crinkle or regular cut, salt added in processing, frozen, as purchased",2.34,4.99,23.96,150,67.11,2
11360,6,"Potatoes, french fried, crinkle or regular cut, salt added in processing, frozen, oven-heated",2.51,5.13,27.5,166,63.07,2.3
11361,6,"Potatoes, roasted, salt added in processing, frozen, unprepared",2.22,1.81,26.15,130,68.08,2.6
11362,6,"Potatoes, raw, skin",2.57,0.1,12.44,58,83.29,2.5
11363,6,"Potatoes, baked, flesh, without salt",1.96,0.1,21.55,93,75.42,1.5
11364,6,"Potatoes, baked, skin, without salt",4.29,0.1,46.06,198,47.31,7.9
11365,6,"Potatoes, boiled, cooked in skin, flesh, without salt",1.87,0.1,20.13,87,76.98,1.8
11366,6,"Potatoes, boiled, cooked in skin, skin, without salt",2.86,0.1,17.21,78,77.8,3.3
11367,6,"Potatoes, boiled, cooked without skin, flesh, without salt",1.71,0.1,20.01,86,77.46,1.8
11368,6,"Potatoes, microwaved, cooked in skin, flesh, without salt",2.1,0.1,23.28,100,73.55,1.6
11369,6,"Potatoes, microwaved, cooked in skin, skin, without salt",4.39,0.1,29.63,132,63.5,5.5
11370,6,"Potatoes, hash brown, home-prepared",3,12.52,35.11,265,47.25,3.2
11371,6,"Potatoes, mashed, home-prepared, whole milk and margarine added",1.96,4.2,16.94,113,75.25,1.5
11372,6,"Potatoes, scalloped, home-prepared with butter",2.87,3.68,10.78,88,80.94,1.9
11373,6,"Potatoes, au gratin, home-prepared from recipe using butter",5.06,7.59,11.27,132,74,1.8
11374,6,"Potatoes, canned, solids and liquids",1.2,0.11,9.89,44,87.83,1.4
11376,6,"Potatoes, canned, drained solids",1.41,0.21,13.61,60,84.28,2.3
11378,6,"Potatoes, mashed, dehydrated, flakes without milk, dry form",8.34,0.41,81.17,354,6.58,6.6
11379,6,"Potatoes, mashed, dehydrated, prepared from flakes without milk, whole milk and butter added",1.77,5.13,10.87,97,81.2,0.8
11380,6,"Potatoes, mashed, dehydrated, granules without milk, dry form",8.22,0.54,85.51,372,3.63,7.1
11381,6,"Potatoes, mashed, dehydrated, prepared from granules without milk, whole milk and butter added",2.05,4.96,14.36,108,77.49,2.2
11382,6,"Potatoes, mashed, dehydrated, granules with milk, dry form",10.9,1.1,77.7,357,6.3,6.6
11383,6,"Potatoes, mashed, dehydrated, prepared from granules with milk, water and margarine added",2.13,4.8,16.13,116,76.01,1.3
11384,6,"Potatoes, au gratin, dry mix, unprepared",8.9,3.7,74.31,314,4.97,4.1
11385,6,"Potatoes, au gratin, dry mix, prepared with water, whole milk and butter",2.3,4.12,12.84,93,78.98,0.9
11386,6,"Potatoes, scalloped, dry mix, unprepared",7.77,4.59,73.93,358,6.22,8.6
11387,6,"Potatoes, scalloped, dry mix, prepared with water, whole milk and butter",2.12,4.3,12.77,93,79.17,1.1
11390,6,"Potatoes, hash brown, frozen, plain, unprepared",2.06,0.62,17.72,82,78.85,1.4
11391,6,"Potatoes, hash brown, frozen, plain, prepared, pan fried in canola oil",2.65,11.59,28.51,219,55.95,3.2
11392,6,"Potatoes, hash brown, frozen, with butter sauce, unprepared",1.87,6.66,18.28,135,72.51,2.9
11393,6,"Potatoes, hash brown, frozen, with butter sauce, prepared",2.46,8.79,24.13,178,63.71,3.8
11394,6,"Potatoes, french fried, shoestring, salt added in processing, frozen, as purchased",2.16,6.24,25.59,167,64.51,2.3
11395,6,"Potatoes, french fried, shoestring, salt added in processing, frozen, oven-heated",2.9,6.76,31.66,199,56.62,2.8
11396,6,"Potatoes, o'brien, frozen, unprepared",1.83,0.14,17.47,76,79.97,1.9
11397,6,"Potatoes, o'brien, frozen, prepared",2.22,13.21,21.86,204,61.96,1.7
11398,6,"Potato puffs, frozen, unprepared",1.93,8.71,24.8,178,62.8,2.3
11399,6,"Potato puffs, frozen, oven-heated",2.13,9.05,27.29,192,59.65,2
11400,6,"Potatoes, frozen, whole, unprepared",2.38,0.16,17.47,78,79.3,1.2
11401,6,"Potatoes, frozen, whole, cooked, boiled, drained, without salt",1.98,0.13,14.52,65,82.8,1.4
11402,6,"Potatoes, french fried, all types, salt added in processing, frozen, unprepared",2.24,4.66,24.81,147,66.61,1.9
11403,6,"Potatoes, french fried, all types, salt added in processing, frozen, home-prepared, oven heated",2.75,5.48,25.55,158,64.44,2
11406,6,"Potatoes, french fried, cottage-cut, salt not added in processing, frozen, as purchased",2.42,5.78,23.98,153,66.82,3
11407,6,"Potatoes, french fried, cottage-cut, salt not added in processing, frozen, oven-heated",3.44,8.2,34.03,218,52.9,3.2
11408,6,"Potatoes, frozen, french fried, par fried, extruded, unprepared",2.83,14.95,30.15,260,49.94,2.9
11409,6,"Potatoes, frozen, french fried, par fried, extruded, prepared, heated in oven, without salt",3.55,18.71,39.68,333,35.4,3.2
11410,6,"USDA Commodity, Potato wedges, frozen",2.7,2.2,25.5,123,68.3,2
11411,6,"Potatoes, french fried, steak fries, salt added in processing, frozen, as purchased",2.19,3.39,23.51,133,69.29,1.9
11412,6,"Potatoes, french fried, steak fries, salt added in processing, frozen, oven-heated",2.57,3.76,26.98,152,64.85,2.6
11413,6,Potato flour,6.9,0.34,83.1,357,6.52,5.9
11414,6,"Potato salad, home-prepared",2.68,8.2,11.17,143,76,1.3
11416,6,"Pumpkin flowers, raw",1.03,0.07,3.28,15,95.15,NULL
11417,6,"Pumpkin flowers, cooked, boiled, drained, without salt",1.09,0.08,3.3,15,95.2,0.9
11418,6,"Pumpkin leaves, raw",3.15,0.4,2.33,19,92.88,NULL
11419,6,"Pumpkin leaves, cooked, boiled, drained, without salt",2.72,0.22,3.39,21,92.51,2.7
11422,6,"Pumpkin, raw",1,0.1,6.5,26,91.6,0.5
11423,6,"Pumpkin, cooked, boiled, drained, without salt",0.72,0.07,4.9,20,93.69,1.1
11424,6,"Pumpkin, canned, without salt",1.1,0.28,8.09,34,89.97,2.9
11426,6,"Pumpkin pie mix, canned",1.09,0.13,26.39,104,71.49,8.3
11427,6,"Purslane, raw",2.03,0.36,3.39,20,92.86,NULL
11428,6,"Purslane, cooked, boiled, drained, without salt",1.49,0.19,3.55,18,93.52,NULL
11429,6,"Radishes, raw",0.68,0.1,3.4,16,95.27,1.6
11430,6,"Radishes, oriental, raw",0.6,0.1,4.1,18,94.62,1.6
11431,6,"Radishes, oriental, cooked, boiled, drained, without salt",0.67,0.24,3.43,17,95.04,1.6
11432,6,"Radishes, oriental, dried",7.9,0.72,63.37,271,19.68,23.9
11435,6,"Rutabagas, raw",1.08,0.16,8.62,37,89.43,2.3
11436,6,"Rutabagas, cooked, boiled, drained, without salt",0.93,0.18,6.84,30,91.54,1.8
11437,6,"Salsify, (vegetable oyster), raw",3.3,0.2,18.6,82,77,3.3
11438,6,"Salsify, cooked, boiled, drained, without salt",2.73,0.17,15.36,68,81,3.1
11439,6,"Sauerkraut, canned, solids and liquids",0.91,0.14,4.28,19,92.52,2.9
11442,6,"Seaweed, agar, raw",0.54,0.03,6.75,26,91.32,0.5
11444,6,"Seaweed, irishmoss, raw",1.51,0.16,12.29,49,81.34,1.3
11445,6,"Seaweed, kelp, raw",1.68,0.56,9.57,43,81.58,1.3
11446,6,"Seaweed, laver, raw",5.81,0.28,5.11,35,85.03,0.3
11447,6,"Sesbania flower, raw",1.28,0.04,6.73,27,91.58,NULL
11448,6,"Sesbania flower, cooked, steamed, without salt",1.14,0.05,5.23,22,93.3,NULL
11450,6,"Soybeans, green, raw",12.95,6.8,11.05,147,67.5,4.2
11451,6,"Soybeans, green, cooked, boiled, drained, without salt",12.35,6.4,11.05,141,68.6,4.2
11452,6,"Soybeans, mature seeds, sprouted, raw",13.09,6.7,9.57,122,69.05,1.1
11453,6,"Soybeans, mature seeds, sprouted, cooked, steamed",8.47,4.45,6.53,81,79.45,0.8
11454,6,"Soybeans, mature seeds, sprouted, cooked, stir-fried",13.1,7.1,9.4,125,67.2,0.8
11457,6,"Spinach, raw",2.86,0.39,3.63,23,91.4,2.2
11458,6,"Spinach, cooked, boiled, drained, without salt",2.97,0.26,3.75,23,91.21,2.4
11459,6,"Spinach, canned, regular pack, solids and liquids",2.11,0.37,2.92,19,93.22,1.6
11461,6,"Spinach, canned, regular pack, drained solids",2.81,0.5,3.4,23,91.78,2.4
11463,6,"Spinach, frozen, chopped or leaf, unprepared",3.63,0.57,4.21,29,90.17,2.9
11464,6,"Spinach, frozen, chopped or leaf, cooked, boiled, drained, without salt",4.01,0.87,4.8,34,88.94,3.7
11467,6,"Squash, summer, crookneck and straightneck, raw",1.01,0.27,3.88,19,94.28,1
11468,6,"Squash, summer, crookneck and straightneck, cooked, boiled, drained, without salt",1.04,0.39,3.79,23,94.25,1.1
11471,6,"Squash, summer, crookneck and straightneck, canned, drained, solid, without salt",0.61,0.07,2.96,13,96.04,1.4
11473,6,"Squash, summer, crookneck and straightneck, frozen, unprepared",0.83,0.14,4.8,20,93.66,1.2
11474,6,"Squash, summer, crookneck and straightneck, frozen, cooked, boiled, drained, without salt",1.28,0.2,5.54,25,92.24,1.4
11475,6,"Squash, summer, scallop, raw",1.2,0.2,3.84,18,94.18,1.2
11476,6,"Squash, summer, scallop, cooked, boiled, drained, without salt",1.03,0.17,3.3,16,95,1.9
11477,6,"Squash, summer, zucchini, includes skin, raw",1.21,0.32,3.11,17,94.79,1
11478,6,"Squash, summer, zucchini, includes skin, cooked, boiled, drained, without salt",1.14,0.36,2.69,15,95.22,1
11479,6,"Squash, summer, zucchini, includes skin, frozen, unprepared",1.16,0.13,3.58,17,94.7,1.3
11480,6,"Squash, summer, zucchini, includes skin, frozen, cooked, boiled, drained, without salt",1.15,0.13,3.56,17,94.74,1.3
11481,6,"Squash, summer, zucchini, italian style, canned",1.03,0.11,6.85,29,90.61,NULL
11482,6,"Squash, winter, acorn, raw",0.8,0.1,10.42,40,87.78,1.5
11483,6,"Squash, winter, acorn, cooked, baked, without salt",1.12,0.14,14.58,56,82.9,4.4
11484,6,"Squash, winter, acorn, cooked, boiled, mashed, without salt",0.67,0.08,8.79,34,89.7,2.6
11485,6,"Squash, winter, butternut, raw",1,0.1,11.69,45,86.41,2
11486,6,"Squash, winter, butternut, cooked, baked, without salt",0.9,0.09,10.49,40,87.8,3.2
11487,6,"Squash, winter, butternut, frozen, unprepared",1.76,0.1,14.41,57,82.5,1.3
11488,6,"Squash, winter, butternut, frozen, cooked, boiled, without salt",1.23,0.07,10.05,39,87.8,NULL
11489,6,"Squash, winter, hubbard, raw",2,0.5,8.7,40,88,3.9
11490,6,"Squash, winter, hubbard, baked, without salt",2.48,0.62,10.81,50,85.1,4.9
11491,6,"Squash, winter, hubbard, cooked, boiled, mashed, without salt",1.48,0.37,6.46,30,91.1,2.9
11492,6,"Squash, winter, spaghetti, raw",0.64,0.57,6.91,31,91.6,1.5
11493,6,"Squash, winter, spaghetti, cooked, boiled, drained, or baked, without salt",0.66,0.26,6.46,27,92.3,1.4
11495,6,"Succotash, (corn and limas), raw",5.03,1.02,19.59,99,73.1,3.8
11496,6,"Succotash, (corn and limas), cooked, boiled, drained, without salt",5.07,0.8,24.38,115,68.37,4.5
11497,6,"Succotash, (corn and limas), canned, with cream style corn",2.64,0.54,17.61,77,78.17,3
11499,6,"Succotash, (corn and limas), canned, with whole kernel corn, solids and liquids",2.6,0.49,13.98,63,81.96,2.6
11501,6,"Succotash, (corn and limas), frozen, unprepared",4.31,0.89,19.94,93,74.11,4
11502,6,"Succotash, (corn and limas), frozen, cooked, boiled, drained, without salt",4.31,0.89,19.95,93,74.1,4.1
11503,6,"Swamp cabbage, (skunk cabbage), raw",2.6,0.2,3.14,19,92.47,2.1
11504,6,"Swamp cabbage (skunk  cabbage), cooked, boiled, drained, without salt",2.08,0.24,3.7,20,92.93,1.9
11505,6,"Sweet potato leaves, raw",2.49,0.51,8.82,42,86.81,5.3
11506,6,"Sweet potato leaves, cooked, steamed, without salt",2.18,0.34,7.38,41,89.2,1.9
11507,6,"Sweet potato, raw, unprepared",1.57,0.05,20.12,86,77.28,3
11508,6,"Sweet potato, cooked, baked in skin, flesh, without salt",2.01,0.15,20.71,90,75.78,3.3
11510,6,"Sweet potato, cooked, boiled, without skin",1.37,0.14,17.72,76,80.13,2.5
11512,6,"Sweet potato, canned, vacuum pack",1.65,0.2,21.12,91,76.03,1.8
11514,6,"Sweet potato, canned, mashed",1.98,0.2,23.19,101,73.88,1.7
11516,6,"Sweet potato, frozen, unprepared",1.71,0.18,22.22,96,74.89,1.7
11517,6,"Sweet potato, frozen, cooked, baked, without salt",1.71,0.12,23.4,100,73.7,1.8
11518,6,"Taro, raw",1.5,0.2,26.46,112,70.64,4.1
11519,6,"Taro, cooked, without salt",0.52,0.11,34.6,142,63.8,5.1
11520,6,"Taro leaves, raw",4.98,0.74,6.7,42,85.66,3.7
11521,6,"Taro leaves, cooked, steamed, without salt",2.72,0.41,4.02,24,92.15,2
11522,6,"Taro shoots, raw",0.92,0.09,2.32,11,95.82,NULL
11523,6,"Taro shoots, cooked, without salt",0.73,0.08,3.2,14,95.3,NULL
11525,6,"Taro, tahitian, raw",2.79,0.97,6.91,44,87.96,NULL
11526,6,"Taro, tahitian, cooked, without salt",4.16,0.68,6.85,44,86.46,NULL
11527,6,"Tomatoes, green, raw",1.2,0.2,5.1,23,93,1.1
11529,6,"Tomatoes, red, ripe, raw, year round average",0.88,0.2,3.89,18,94.52,1.2
11530,6,"Tomatoes, red, ripe, cooked",0.95,0.11,4.01,18,94.34,0.7
11531,6,"Tomatoes, red, ripe, canned, packed in tomato juice",0.79,0.25,3.47,16,94.75,1.9
11533,6,"Tomatoes, red, ripe, canned, stewed",0.91,0.19,6.19,26,91.54,1
11537,6,"Tomatoes, red, ripe, canned, with green chilies",0.69,0.08,3.62,15,94.23,NULL
11540,6,"Tomato juice, canned, with salt added",0.85,0.29,3.53,17,94.24,0.4
11546,6,"Tomato products, canned, paste, without salt added",4.32,0.47,18.91,82,73.5,4.1
11547,6,"Tomato products, canned, puree, without salt added",1.65,0.21,8.98,38,87.88,1.9
11548,6,Tomato powder,12.91,0.44,74.68,302,3.06,16.5
11549,6,"Tomato products, canned, sauce",1.2,0.3,5.31,24,91.28,1.5
11551,6,"Tomato products, canned, sauce, with mushrooms",1.45,0.13,8.43,35,87.97,1.5
11553,6,"Tomato products, canned, sauce, with onions",1.56,0.19,9.94,42,86.09,1.8
11555,6,"Tomato products, canned, sauce, with herbs and cheese",2.13,1.93,10.24,59,83.43,2.2
11557,6,"Tomato products, canned, sauce, with onions, green peppers, and celery",0.94,0.74,8.77,41,88.28,1.4
11559,6,"Tomato products, canned, sauce, with tomato tidbits",1.32,0.39,7.09,32,89.09,1.4
11563,6,"Tree fern, cooked, without salt",0.29,0.07,10.98,40,88.6,3.7
11564,6,"Turnips, raw",0.9,0.1,6.43,28,91.87,1.8
11565,6,"Turnips, cooked, boiled, drained, without salt",0.71,0.08,5.06,22,93.6,2
11566,6,"Turnips, frozen, unprepared",1.04,0.16,2.94,16,95.67,1.8
11567,6,"Turnips, frozen, cooked, boiled, drained, without salt",1.53,0.24,4.35,23,93.6,2
11568,6,"Turnip greens, raw",1.5,0.3,7.13,32,89.67,3.2
11569,6,"Turnip greens, cooked, boiled, drained, without salt",1.14,0.23,4.36,20,93.2,3.5
11570,6,"Turnip greens, canned, solids and liquids",1.36,0.3,2.42,14,94.69,1.7
11574,6,"Turnip greens, frozen, unprepared",2.47,0.31,3.67,22,92.93,2.5
11575,6,"Turnip greens, frozen, cooked, boiled, drained, without salt",3.35,0.42,4.98,29,90.4,3.4
11576,6,"Turnip greens and turnips, frozen, unprepared",2.46,0.19,3.39,21,93.13,2.4
11577,6,"Turnip greens and turnips, frozen, cooked, boiled, drained, without salt",2.99,0.38,4.85,35,91.04,3.1
11578,6,"Vegetable juice cocktail, canned",0.93,0.31,3.87,22,94.09,0.5
11579,6,"Vegetables, mixed, canned, solids and liquids",1.42,0.25,7.13,36,90.24,3.8
11581,6,"Vegetables, mixed, canned, drained solids",2.59,0.25,9.26,49,87.01,3
11583,6,"Vegetables, mixed, frozen, unprepared",3.33,0.52,13.47,72,82.08,4
11584,6,"Vegetables, mixed, frozen, cooked, boiled, drained, without salt",2.86,0.15,13.09,65,83.23,4.4
11585,6,"Vegetable juice cocktail, low sodium, canned",0.91,0.32,3.83,19,94.13,0.5
11587,6,"Vinespinach, (basella), raw",1.8,0.3,3.4,19,93.1,NULL
11588,6,"Waterchestnuts, chinese, (matai), raw",1.4,0.1,23.94,97,73.46,3
11590,6,"Waterchestnuts, chinese, canned, solids and liquids",0.88,0.06,12.3,50,86.42,2.5
11591,6,"Watercress, raw",2.3,0.1,1.29,11,95.11,0.5
11593,6,"Waxgourd, (chinese preserving melon), raw",0.4,0.2,3,13,96.1,2.9
11594,6,"Waxgourd, (chinese preserving melon), cooked, boiled, drained, without salt",0.4,0.2,3.04,14,96.06,1
11595,6,"Winged beans, immature seeds, raw",6.95,0.87,4.31,49,87.04,NULL
11596,6,"Winged beans, immature seeds, cooked, boiled, drained, without salt",5.31,0.66,3.21,38,90.11,NULL
11597,6,"Winged bean leaves, raw",5.85,1.1,14.1,74,76.85,NULL
11599,6,"Winged bean tuber, raw",11.6,0.9,28.1,148,57.4,NULL
11601,6,"Yam, raw",1.53,0.17,27.88,118,69.6,4.1
11602,6,"Yam, cooked, boiled, drained, or baked, without salt",1.49,0.14,27.48,116,70.13,3.9
11603,6,"Yambean (jicama), raw",0.72,0.09,8.82,38,90.07,4.9
11604,6,"Yambean (jicama), cooked, boiled, drained, without salt",0.72,0.09,8.82,38,90.07,NULL
11605,6,"Beets, harvard, canned, solids and liquids",0.84,0.06,18.18,73,80.16,2.5
11609,6,"Beets, pickled, canned, solids and liquids",0.8,0.08,16.28,65,81.88,0.8
11613,6,"Borage, raw",1.8,0.7,3.06,21,93,NULL
11614,6,"Borage, cooked, boiled, drained, without salt",2.09,0.81,3.55,25,91.88,NULL
11615,6,"Chives, freeze-dried",21.2,3.5,64.29,311,2,26.2
11616,6,"Dock, raw",2,0.7,3.2,22,93,2.9
11617,6,"Dock, cooked, boiled, drained, without salt",1.83,0.64,2.93,20,93.6,2.6
11618,6,"Eppaw, raw",4.6,1.8,31.68,150,60,NULL
11620,6,"Drumstick pods, raw",2.1,0.2,8.53,37,88.2,3.2
11621,6,"Drumstick pods, cooked, boiled, drained, without salt",2.09,0.19,8.18,36,88.42,4.2
11622,6,"Kale, scotch, raw",2.8,0.6,8.32,42,87,1.7
11623,6,"Kale, scotch, cooked, boiled, drained, without salt",1.9,0.41,5.63,28,91.2,1.2
11624,6,"Leeks, (bulb and lower-leaf portion), freeze-dried",15.2,2.1,74.65,321,2,10.4
11625,6,"Parsley, freeze-dried",31.3,5.2,42.38,271,2,32.7
11626,6,"Beans, mung, mature seeds, sprouted, canned, drained solids",1.4,0.06,2.14,12,96.1,0.8
11632,6,"Peppers, jalapeno, canned, solids and liquids",0.92,0.94,4.74,27,88.89,2.6
11634,6,"Peppers, sweet, green, freeze-dried",17.9,3,68.7,314,2,21.3
11637,6,"Radishes, white icicle, raw",1.1,0.1,2.63,14,95.37,1.4
11640,6,"Shallots, freeze-dried",12.3,0.5,80.7,348,2,15.7
11641,6,"Squash, summer, all varieties, raw",1.21,0.18,3.35,16,94.64,1.1
11642,6,"Squash, summer, all varieties, cooked, boiled, drained, without salt",0.91,0.31,4.31,20,93.7,1.4
11643,6,"Squash, winter, all varieties, raw",0.95,0.13,8.59,34,89.76,1.5
11644,6,"Squash, winter, all varieties, cooked, baked, without salt",0.89,0.35,8.85,37,89.21,2.8
11645,6,"Sweet potato, canned, syrup pack, solids and liquids",0.98,0.2,20.93,89,77.39,2.5
11647,6,"Sweet potato, canned, syrup pack, drained solids",1.28,0.32,25.36,108,72.47,3
11649,6,"Tomato products, canned, sauce, spanish style",1.44,0.27,7.24,33,89.08,1.4
11653,6,"Beans, pinto, mature seeds, sprouted, raw",5.25,0.9,11.6,62,81.3,NULL
11654,6,"Beans, pinto, mature seeds, sprouted, cooked, boiled, drained, without salt",1.86,0.32,4.1,22,93.39,NULL
11655,6,"Carrot juice, canned",0.95,0.15,9.28,40,88.87,0.8
11656,6,"Corn pudding, home prepared",4.42,5.04,16.97,131,72.33,1.2
11657,6,"Potatoes, mashed, home-prepared, whole milk added",1.91,0.57,17.57,83,78.48,1.5
11658,6,Spinach souffle,7.89,12.95,5.9,172,70.73,0.7
11659,6,"Sweet potato, cooked, candied, home-prepared",0.89,3.54,32.12,164,62.75,2.1
11660,6,"Tomatoes, red, ripe, cooked, stewed",1.96,2.68,13.05,79,80.63,1.7
11663,6,"Seaweed, agar, dried",6.21,0.3,80.88,306,8.68,7.7
11666,6,"Seaweed, spirulina, raw",5.92,0.39,2.42,26,90.67,0.4
11667,6,"Seaweed, spirulina, dried",57.47,7.72,23.9,290,4.68,3.6
11669,6,"Seaweed, wakame, raw",3.03,0.64,9.14,45,79.99,0.5
11670,6,"Peppers, hot chili, green, raw",2,0.2,9.46,40,87.74,1.5
11671,6,"Potatoes, o'brien, home-prepared",2.35,1.28,15.47,81,79.6,NULL
11672,6,Potato pancakes,6.08,14.76,27.81,268,47.77,3.3
11674,6,"Potatoes, baked, flesh and skin, without salt",2.5,0.13,21.15,93,74.89,2.2
11675,6,"Potatoes, microwaved, cooked in skin, flesh and skin, without salt",2.44,0.1,24.24,105,72.04,2.3
11676,6,"Radish seeds, sprouted, raw",3.81,2.53,3.6,43,90.07,NULL
11677,6,"Shallots, raw",2.5,0.1,16.8,72,79.8,3.2
11683,6,"Carrot, dehydrated",8.1,1.49,79.57,341,4,23.6
11693,6,"Tomatoes, crushed, canned",1.64,0.28,7.29,32,89.44,1.9
11695,6,"Tomatoes, orange, raw",1.16,0.19,3.18,16,94.78,0.9
11696,6,"Tomatoes, yellow, raw",0.98,0.26,2.98,15,95.28,0.7
11697,6,"Arrowroot, raw",4.24,0.2,13.39,65,80.75,1.3
11698,6,"Chrysanthemum leaves, raw",3.36,0.56,3.01,24,91.4,3
11700,6,"Amaranth leaves, cooked, boiled, drained, with salt",2.11,0.18,4.11,21,91.49,NULL
11701,6,"Arrowhead, cooked, boiled, drained, with salt",4.49,0.1,16.14,78,77.08,NULL
11702,6,"Artichokes, (globe or french), cooked, boiled, drained, with salt",2.89,0.34,11.39,51,84.08,5.7
11703,6,"Artichokes, (globe or french), frozen, cooked, boiled, drained, with salt",3.11,0.5,9.18,45,86.5,4.6
11705,6,"Asparagus, cooked, boiled, drained, with salt",2.4,0.22,4.11,22,92.63,2
11707,6,"Asparagus, canned, no salt added, solids and liquids",1.8,0.18,2.48,15,94.32,1
11709,6,"Asparagus, frozen, cooked, boiled, drained, with salt",2.95,0.42,1.92,18,94.1,1.6
11710,6,"Balsam-pear (bitter gourd), leafy tips, cooked, boiled, drained, with salt",3.6,0.2,6.16,32,88.69,1.9
11711,6,"Balsam-pear (bitter gourd), pods, cooked, boiled, drained, with salt",0.84,0.18,4.32,19,93.95,2
11712,6,"Bamboo shoots, cooked, boiled, drained, with salt",1.53,0.22,1.52,11,95.92,1
11713,6,"Beans, kidney, mature seeds, sprouted, cooked, boiled, drained, with salt",4.83,0.58,4.72,33,89.3,NULL
11714,6,"Lima beans, immature seeds, cooked, boiled, drained, with salt",6.81,0.32,23.64,123,67.17,5.3
11715,6,"Lima beans, immature seeds, canned, no salt added, solids and liquids",4.07,0.29,13.33,71,81.17,3.6
11716,6,"Lima beans, immature seeds, frozen, baby, cooked, boiled, drained, with salt",6.65,0.3,19.45,105,72.35,4.8
11717,6,"Lima beans, immature seeds, frozen, fordhook, cooked, boiled, drained, with salt",6.07,0.34,19.32,103,72.98,5.3
11718,6,"Mung beans, mature seeds, sprouted, cooked, boiled, drained, with salt",2.03,0.09,3.6,19,93.39,0.8
11719,6,"Beans, navy, mature seeds, sprouted, cooked, boiled, drained, with salt",7.07,0.81,15.01,78,76.02,NULL
11720,6,"Beans, pinto, immature seeds, frozen, cooked, boiled, drained, with salt",9.31,0.48,30.87,162,58.01,5.4
11721,6,"Beans, pinto, mature seeds, sprouted, cooked, boiled, drained, with salt",1.86,0.32,3.5,20,93.39,NULL
11722,6,"Beans, snap, yellow, raw",1.82,0.12,7.13,31,90.27,3.4
11723,6,"Beans, snap, green, cooked, boiled, drained, with salt",1.89,0.28,7.88,35,89.22,3.2
11724,6,"Beans, snap, yellow, cooked, boiled, drained, without salt",1.89,0.28,7.88,35,89.22,3.3
11725,6,"Beans, snap, yellow, cooked, boiled, drained, with salt",1.89,0.28,7.88,35,89.22,3.3
11726,6,"Beans, snap, green, canned, no salt added, solids and liquids",0.8,0.1,3.5,15,94.68,1.5
11727,6,"Beans, snap, yellow, canned, regular pack, solids and liquids",0.8,0.1,3.5,15,94.68,1.5
11728,6,"Beans, snap, yellow, canned, no salt added, solids and liquids",0.8,0.1,3.5,15,94.68,1.5
11729,6,"Beans, snap, green, canned, no salt added, drained solids",1.12,0.46,4.32,22,93.38,1.9
11730,6,"Beans, snap, yellow, frozen, all styles, unprepared",1.8,0.21,7.58,33,89.88,2.8
11731,6,"Beans, snap, green, frozen, cooked, boiled, drained, with salt",1.49,0.17,6.45,28,91.42,3
11732,6,"Beans, snap, yellow, frozen, cooked, boiled, drained, without salt",1.49,0.17,6.45,28,91.42,3
11733,6,"Beans, snap, yellow, frozen, cooked, boiled, drained, with salt",1.49,0.17,6.45,28,91.42,3
11734,6,"Beets, cooked, boiled. drained, with salt",1.68,0.18,9.96,44,87.06,2
11735,6,"Beets, canned, no salt added, solids and liquids",0.8,0.07,6.57,28,91.62,1.2
11736,6,"Beet greens, cooked, boiled, drained, with salt",2.57,0.2,5.46,27,89.13,2.9
11737,6,"Borage, cooked, boiled, drained, with salt",2.09,0.81,3.55,25,91.88,NULL
11738,6,"Broadbeans, immature seeds, cooked, boiled, drained, with salt",4.8,0.5,10.1,62,83.7,NULL
11739,6,"Broccoli, leaves, raw",2.98,0.35,5.06,28,90.69,2.3
11740,6,"Broccoli, flower clusters, raw",2.98,0.35,5.06,28,90.69,2.3
11741,6,"Broccoli, stalks, raw",2.98,0.35,5.24,28,90.69,NULL
11742,6,"Broccoli, cooked, boiled, drained, with salt",2.38,0.41,7.18,35,89.25,3.3
11743,6,"Broccoli, frozen, chopped, cooked, boiled, drained, with salt",3.1,0.12,5.35,28,90.72,3
11744,6,"Broccoli, frozen, spears, cooked, boiled, drained, with salt",3.1,0.11,5.35,28,90.72,3
11745,6,"Brussels sprouts, cooked, boiled, drained, with salt",2.55,0.5,7.1,36,88.9,2.6
11746,6,"Brussels sprouts, frozen, cooked, boiled, drained, with salt",3.64,0.39,8.32,42,86.74,4.1
11747,6,"Burdock root, cooked, boiled, drained, with salt",2.09,0.14,21.15,88,75.64,1.8
11748,6,"Butterbur, cooked, boiled, drained, with salt",0.23,0.02,2.16,8,96.7,NULL
11749,6,"Cabbage, common (danish, domestic, and pointed types), freshly harvest, raw",1.21,0.18,5.37,24,92.52,2.3
11750,6,"Cabbage, common (danish, domestic, and pointed types), stored, raw",1.21,0.18,5.37,24,92.52,2.3
11751,6,"Cabbage, common, cooked, boiled, drained, with salt",1.27,0.06,5.51,23,92.57,1.9
11752,6,"Cabbage, red, cooked, boiled, drained, with salt",1.51,0.09,6.94,29,90.84,2.6
11753,6,"Cabbage, savoy, cooked, boiled, drained, with salt",1.8,0.09,5.41,24,92,2.8
11754,6,"Cabbage, chinese (pak-choi), cooked, boiled, drained, with salt",1.56,0.16,1.78,12,95.55,1
11755,6,"Cabbage, chinese (pe-tsai), cooked, boiled, drained, with salt",1.5,0.17,2.41,14,95.24,1.7
11756,6,"Cardoon, cooked, boiled, drained, with salt",0.76,0.11,4.74,20,93.46,1.7
11757,6,"Carrots, cooked, boiled, drained, with salt",0.76,0.18,8.22,35,90.17,3
11758,6,"Carrots, canned, no salt added, solids and liquids",0.59,0.14,5.36,23,92.99,1.8
11759,6,"Carrots, canned, no salt added, drained solids",0.64,0.19,5.54,25,92.95,1.5
11760,6,"Carrots, frozen, cooked, boiled, drained, with salt",0.58,0.68,7.73,37,90.32,3.3
11761,6,"Cauliflower, cooked, boiled, drained, with salt",1.84,0.45,4.11,23,93,2.3
11762,6,"Cauliflower, frozen, cooked, boiled, drained, with salt",1.61,0.22,3.16,17,94,2.7
