id,food_group_id,name,protein,fat,carbs,calories,water,fiber
14428,0,"Beverages, shake, fast food, strawberry",3.4,2.8,18.9,113,74.1,0.4
14429,0,"Beverages, water, tap, municipal",0,0,0,0,99.9,0
14430,0,"Cranberry juice cocktail, frozen concentrate",0.05,0,51.45,201,48.4,0.2
14431,0,"Cranberry juice cocktail, frozen concentrate, prepared with water",0.01,0,11.81,47,88.08,0
14432,0,"Beverages, water, bottled, non-carbonated, DANNON",0,0,0,0,99.98,NULL
14433,0,"Beverages, water, bottled, non-carbonated, PEPSI, AQUAFINA",0,0,0,0,99.97,NULL
14434,0,"Beverages, The COCA-COLA company, DASANI, water, bottled, non-carbonated",0,0,0,0,99.96,NULL
14436,0,"Beverages, orange breakfast drink, ready-to-drink, with added nutrients",0,0,13.2,53,85.4,0.1
14437,0,"Beverages, water, bottled, non-carbonated, CALISTOGA",0,0,0,0,100,NULL
14438,0,"Beverages, water, bottled, non-carbonated, CRYSTAL GEYSER",0,0,0,0,100,NULL
14439,0,"Water, bottled, non-carbonated, NAYA",0,0,0,0,100,NULL
14440,0,"Beverages, water, bottled, non-carbonated, DANNON Fluoride To Go",0,0,0.03,0,99.97,NULL
14450,0,"Beverages, drink mix, QUAKER OATS, GATORADE, orange flavor, powder",0,1.23,94.11,388,2.51,0
14460,0,"Beverages, PEPSICO QUAKER, Gatorade, G performance O 2, ready-to-drink.",0,0,6.43,26,93.38,0
14461,0,"Beverages, COCA-COLA, POWERADE, lemon-lime flavored, ready-to-drink",0,0.05,7.84,32,91.91,0
14462,0,"Beverages, Propel Zero, fruit-flavored, non-carbonated",0,0,1.14,5,98.78,0
14475,0,"Beverages, ARIZONA, tea, ready-to-drink, lemon",0,0,9.77,39,90.15,0
14476,0,"Beverages, LIPTON BRISK, tea, black, ready-to-drink, lemon",0,0,8.81,35,91.06,0
14530,0,"Whiskey sour mix, bottled, with added potassium and sodium",0.1,0.1,21.4,84,78.2,0
14531,0,"Alcoholic beverage, whiskey sour",0,0.03,13.17,149,72.6,0
14532,0,"Alcoholic beverage, distilled, all (gin, rum, vodka, whiskey) 94 proof",0,0,0,275,60.3,0
14533,0,"Alcoholic beverage, distilled, all (gin, rum, vodka, whiskey) 100 proof",0,0,0,295,57.5,0
14534,0,"Alcoholic beverage, liqueur, coffee, 63 proof",0.1,0.3,32.2,308,41.4,0
14536,0,"Alcoholic beverage, wine, dessert, dry",0.2,0,11.67,152,72.53,0
14537,0,"Carbonated beverage, low calorie, other than cola or pepper, with sodium saccharin, without caffeine",0,0,0.1,0,99.8,0
14538,0,"Beverages, Cocoa mix, low calorie, powder, with added calcium, phosphorus, aspartame, without added sodium or vitamin A",25.1,3,58,359,3.4,1.1
14541,0,"Beverages, fruit punch-flavor drink, powder, without added sodium, prepared with water",0,0.01,9.47,37,90.35,0
14542,0,"Lemonade, frozen concentrate, pink",0.22,0.69,48.86,192,50.09,0.3
14543,0,"Beverages, lemonade, frozen concentrate, pink, prepared with water",0.05,0.15,10.81,43,88.88,0.1
14544,0,"Beverages, tea, black, brewed, prepared with distilled water",0,0,0.3,1,99.7,0
14545,0,"Beverages, tea, herb, brewed, chamomile",0,0,0.2,1,99.7,0
14548,0,"Beverages, tea, instant, lemon, with added ascorbic acid",0.6,0.3,97.6,385,0.3,0
14550,0,"Alcoholic beverage, distilled, all (gin, rum, vodka, whiskey) 86 proof",0,0,0.1,250,63.9,0
14551,0,"Alcoholic beverage, distilled, all (gin, rum, vodka, whiskey) 90 proof",0,0,0,263,62.1,0
14552,0,"Carbonated beverage, chocolate-flavored soda",0,0,10.7,42,89.2,0
14553,0,"Beverages, Wine, non-alcoholic",0.5,0,1.1,6,98.2,0
14555,0,"Water, bottled, generic",0,0,0,0,99.98,0
14557,0,"Beverages, chocolate-flavor beverage mix for milk, powder, with added nutrients",4.55,2.27,90.28,400,1.1,4.5
14558,0,"Beverages, chocolate-flavor beverage mix for milk, powder, with added nutrients, prepared with whole milk",3.27,3.17,11.87,89,80.93,0.4
14559,0,"Beverages, water, bottled, non-carbonated, EVIAN",0,0,0,0,99.97,NULL
14599,0,"Beverages, Powerade Zero Ion4, calorie-free, assorted flavors",0,0,0,0,99.89,0
14601,0,"Beverages, WENDY'S, tea, ready-to-drink, unsweetened",0.22,0,0,1,99.79,NULL
14602,0,"Alcoholic Beverage, wine, table, red, Merlot",0.07,0,2.51,83,86.59,0
14604,0,"Water, non-carbonated, bottles, natural fruit flavors, sweetened with low calorie sweetener",0,0,0.13,1,99.85,0
14605,0,"Beverages, Water with added vitamins and minerals, bottles, sweetened, assorted fruit flavors",0,0,5.49,22,94.44,0
14607,0,"Beverages, V8 SPLASH Juice Drinks, Diet Berry Blend",0,0,1.23,4,98.7,NULL
14608,0,"Beverages, V8 SPLASH Juice Drinks, Diet Fruit Medley",0,0,1.26,4,98.8,NULL
14609,0,"Beverages, V8 SPLASH Juice Drinks, Diet Strawberry Kiwi",0,0,1.26,4,98.8,NULL
14610,0,"Beverages, V8 SPLASH Juice Drinks, Diet Tropical Blend",0,0,1.26,4,98.8,NULL
14611,0,"Beverages, V8 SPLASH Juice Drinks, Berry Blend",0,0,7.41,29,92.2,NULL
14612,0,"Beverages, V8 SPLASH Juice Drinks, Fruit Medley",0,0,7.82,33,91.8,NULL
14613,0,"Beverages, V8 SPLASH Juice Drinks, Guava Passion Fruit",0,0,7.82,33,91.9,NULL
14614,0,"Beverages, V8 SPLASH Juice Drinks, Mango Peach",0,0,8.23,33,91.6,NULL
14615,0,"Beverages, V8 SPLASH Juice Drinks, Orange Pineapple",0,0,7.41,29,91.9,NULL
14616,0,"Beverages, V8 SPLASH Juice Drinks, Orchard Blend",0,0,7.82,33,92.2,NULL
14617,0,"Beverages, V8 SPLASH Juice Drinks, Strawberry Banana",0,0,7.41,29,92.2,NULL
14618,0,"Beverages, V8 SPLASH Juice Drinks, Strawberry Kiwi",0,0,7.41,29,92.4,NULL
14619,0,"Beverages, V8 SPLASH Juice Drinks, Tropical Blend",0,0,7.41,29,92.4,NULL
14620,0,"Beverages, V8 V-FUSION Juices, Peach Mango",0.41,0,11.38,49,87.8,0
14621,0,"Beverages, V8 V-FUSION Juices, Strawberry Banana",0.41,0,11.79,49,87.9,0
14622,0,"Beverages, V8 V-FUSION Juices, Tropical",0.41,0,11.38,49,88,0
14623,0,"Beverages, V8 V- FUSION Juices, Acai Berry",0,0,10.98,45,88.4,0
14625,0,"Beverages, Energy drink, AMP",0.25,0.08,12.08,46,87.3,0
14626,0,"Beverages, Energy drink, FULL THROTTLE",0.25,0.08,12.08,46,87.3,0
14627,0,"Beverages, Energy Drink, Monster, fortified with vitamins C, B2, B3, B6, B12",0.47,0,11.28,47,88.05,0
14628,0,"Beverages, Energy drink, AMP, sugar free",0,0,1.03,2,98.35,0
14629,0,"Beverages, Energy drink, ROCKSTAR",0.34,0.22,12.7,58,87.08,0
14630,0,"Beverages, Energy drink, ROCKSTAR, sugar free",0.25,0.08,0.7,4,98.35,0
14631,0,"Beverages, Horchata, dry mix, unprepared, variety of brands, all with morro seeds",7.5,7.46,79.05,413,4.89,4
14632,0,"Beverages, Meal supplement drink, canned, peanut flavor",3.5,3.07,14.74,101,77.79,NULL
14633,0,"Beverages, Vegetable and fruit juice drink, reduced calorie, with low-calorie sweetener, added vitamin C",0,0,1.1,4,98.78,0
14634,0,"Beverages, milk beverage, reduced fat, flavored and sweetened, Ready-to-drink,  added calcium, vitamin A and vitamin D",3.05,1.83,12.08,77,82.32,0.4
14635,0,"Beverages, vegetable and fruit juice blend, 100% juice, with added vitamins A, C, E",0.3,0.01,11.15,46,88.4,0
14636,0,"Beverages, fruit juice drink, reduced sugar, with vitamin E added",0,0.07,10,39,87.58,0
14637,0,"Water, with corn syrup and/or sugar and low calorie sweetener, fruit flavored",0,0,4.5,18,94.44,0
14638,0,"Beverages, Horchata, as served in restaurant",0.48,0.71,11.52,54,87.1,0
14639,0,"Beverages, rice milk, unsweetened",0.28,0.97,9.17,47,89.28,0.3
14640,0,"Beverages, Energy drink, VAULT, citrus flavor",0,0,12.99,49,86.73,0
14641,0,"Beverages, Energy drink, VAULT Zero, sugar-free, citrus flavor",0.25,0.08,0.7,1,98.35,0
14644,0,"Beverages, PEPSICO QUAKER, Gatorade G2, low calorie",0.05,0.01,1.94,8,97.94,0
14645,0,"Beverages, Fruit flavored drink, less than 3% juice, not fortified with vitamin C",0,0,16.03,64,83.87,0
14646,0,"Beverages, Fruit flavored drink containing less than 3% fruit juice, with high vitamin C",0,0,6.67,27,93.2,0
14647,0,"Beverages, Fruit flavored drink, reduced sugar, greater than 3% fruit juice, high vitamin C, added calcium",0,0.37,6.67,29,93,0
14648,0,"Beverages, fruit juice drink, greater than 3% fruit juice, high vitamin C and added thiamin",0.13,0,13.16,54,86.39,0.1
14649,0,"Beverages, tea, hibiscus, brewed",0,0,0,0,99.58,0
14651,0,"Beverages, fruit juice drink, greater than 3% juice, high vitamin C",0.13,0.11,11.35,46,88.1,0.1
14654,0,"Beverages, nutritional shake mix, high protein, powder",53.57,10.71,20.38,392,8.3,0
15001,8,"Fish, anchovy, european, raw",20.35,4.84,0,131,73.37,0
15002,8,"Fish, anchovy, european, canned in oil, drained solids",28.89,9.71,0,210,50.3,0
15003,8,"Fish, bass, fresh water, mixed species, raw",18.86,3.69,0,114,75.66,0
15004,8,"Fish, bass, striped, raw",17.73,2.33,0,97,79.22,0
15005,8,"Fish, bluefish, raw",20.04,4.24,0,124,70.86,0
15006,8,"Fish, burbot, raw",19.31,0.81,0,90,79.26,0
15007,8,"Fish, butterfish, raw",17.28,8.02,0,146,74.13,0
15008,8,"Fish, carp, raw",17.83,5.6,0,127,76.31,0
15009,8,"Fish, carp, cooked, dry heat",22.86,7.17,0,162,69.63,0
15010,8,"Fish, catfish, channel, wild, raw",16.38,2.82,0,95,80.36,0
15011,8,"Fish, catfish, channel, cooked, breaded and fried",18.09,13.33,8.04,229,58.81,0.7
15012,8,"Fish, caviar, black and red, granular",24.6,17.9,4,264,47.5,0
15013,8,"Fish, cisco, raw",18.99,1.91,0,98,78.93,0
15014,8,"Fish, cisco, smoked",16.36,11.9,0,177,69.8,0
15015,8,"Fish, cod, Atlantic, raw",17.81,0.67,0,82,81.22,0
15016,8,"Fish, cod, Atlantic, cooked, dry heat",22.83,0.86,0,105,75.92,0
15017,8,"Fish, cod, Atlantic, canned, solids and liquid",22.76,0.86,0,105,75.61,0
15018,8,"Fish, cod, Atlantic, dried and salted",62.82,2.37,0,290,16.14,0
15019,8,"Fish, cod, Pacific, raw (may have been previously frozen)",15.27,0.41,0,69,83.95,0
15020,8,"Fish, croaker, Atlantic, raw",17.78,3.17,0,104,78.03,0
15021,8,"Fish, croaker, Atlantic, cooked, breaded and fried",18.2,12.67,7.54,221,59.76,0.4
15022,8,"Fish, cusk, raw",18.99,0.69,0,87,76.35,0
15023,8,"Fish, mahimahi, raw",18.5,0.7,0,85,77.55,0
15024,8,"Fish, drum, freshwater, raw",17.54,4.93,0,119,77.33,0
15025,8,"Fish, eel, mixed species, raw",18.44,11.66,0,184,68.26,0
15026,8,"Fish, eel, mixed species, cooked, dry heat",23.65,14.95,0,236,59.31,0
15027,8,"Fish, fish sticks, frozen, prepared",11.01,16.23,21.66,277,49.5,1.5
15028,8,"Fish, flatfish (flounder and sole species), raw",12.41,1.93,0,70,84.63,0
15029,8,"Fish, flatfish (flounder and sole species), cooked, dry heat",15.24,2.37,0,86,81.11,0
15030,8,"Fish, gefiltefish, commercial, sweet recipe",9.07,1.73,7.41,84,80.35,0
15031,8,"Fish, grouper, mixed species, raw",19.38,1.02,0,92,79.22,0
15032,8,"Fish, grouper, mixed species, cooked, dry heat",24.84,1.3,0,118,73.36,0
15033,8,"Fish, haddock, raw",16.32,0.45,0,74,83.38,0
15034,8,"Fish, haddock, cooked, dry heat",19.99,0.55,0,90,79.65,0
15035,8,"Fish, haddock, smoked",25.23,0.96,0,116,71.48,0
15036,8,"Fish, halibut, Atlantic and Pacific, raw",18.56,1.33,0,91,80.34,0
15037,8,"Fish, halibut, Atlantic and Pacific, cooked, dry heat",22.54,1.61,0,111,76.12,0
15038,8,"Fish, halibut, Greenland, raw",14.37,13.84,0,186,70.27,0
15039,8,"Fish, herring, Atlantic, raw",17.96,9.04,0,158,72.05,0
15040,8,"Fish, herring, Atlantic, cooked, dry heat",23.03,11.59,0,203,64.16,0
15041,8,"Fish, herring, Atlantic, pickled",14.19,18,9.64,262,55.22,0
15042,8,"Fish, herring, Atlantic, kippered",24.58,12.37,0,217,59.7,0
15043,8,"Fish, herring, Pacific, raw",16.39,13.88,0,195,71.52,0
15044,8,"Fish, ling, raw",18.99,0.64,0,87,79.63,0
15045,8,"Fish, lingcod, raw",17.66,1.06,0,85,81.03,0
15046,8,"Fish, mackerel, Atlantic, raw",18.6,13.89,0,205,63.55,0
15047,8,"Fish, mackerel, Atlantic, cooked, dry heat",23.85,17.81,0,262,53.27,0
15048,8,"Fish, mackerel, jack, canned, drained solids",23.19,6.3,0,156,69.17,0
15049,8,"Fish, mackerel, king, raw",20.28,2,0,105,75.85,0
15050,8,"Fish, mackerel, Pacific and jack, mixed species, raw",20.07,7.89,0,158,70.15,0
15051,8,"Fish, mackerel, spanish, raw",19.29,6.3,0,139,71.67,0
15052,8,"Fish, mackerel, spanish, cooked, dry heat",23.59,6.32,0,158,68.46,0
15053,8,"Fish, milkfish, raw",20.53,6.73,0,148,70.85,0
15054,8,"Fish, monkfish, raw",14.48,1.52,0,76,83.24,0
15055,8,"Fish, mullet, striped, raw",19.35,3.79,0,117,77.01,0
15056,8,"Fish, mullet, striped, cooked, dry heat",24.81,4.86,0,150,70.52,0
15057,8,"Fish, ocean perch, Atlantic, raw",15.31,1.54,0,79,83.07,0
15058,8,"Fish, ocean perch, Atlantic, cooked, dry heat",18.51,1.87,0,96,74.24,0
15059,8,"Fish, pout, ocean, raw",16.64,0.91,0,79,81.36,0
15060,8,"Fish, perch, mixed species, raw",19.39,0.92,0,91,79.13,0
15061,8,"Fish, perch, mixed species, cooked, dry heat",24.86,1.18,0,117,73.25,0
15062,8,"Fish, pike, northern, raw",19.26,0.69,0,88,78.92,0
15063,8,"Fish, pike, northern, cooked, dry heat",24.69,0.88,0,113,72.97,0
15064,8,"Fish, pike, walleye, raw",19.14,1.22,0,93,79.31,0
15065,8,"Fish, pollock, Atlantic, raw",19.44,0.98,0,92,78.18,0
15066,8,"Fish, pollock, Alaska, raw (may have been previously frozen)",12.19,0.41,0,56,86.75,0
15067,8,"Fish, pollock, Alaska, cooked, dry heat (may have been previously frozen)",23.48,1.18,0,111,73.65,0
15068,8,"Fish, pompano, florida, raw",18.48,9.47,0,164,71.12,0
15069,8,"Fish, pompano, florida, cooked, dry heat",23.69,12.14,0,211,62.97,0
15070,8,"Fish, rockfish, Pacific, mixed species, raw",18.36,1.34,0,90,79.08,0
15071,8,"Fish, rockfish, Pacific, mixed species, cooked, dry heat",22.23,1.62,0,109,74.67,0
15072,8,"Fish, roe, mixed species, raw",22.32,6.42,1.5,143,67.73,0
15073,8,"Fish, roughy, orange, raw",16.41,0.7,0,76,75.67,0
15074,8,"Fish, sablefish, raw",13.41,15.3,0,195,71.02,0
15075,8,"Fish, sablefish, smoked",17.65,20.14,0,257,60.14,0
15076,8,"Fish, salmon, Atlantic, wild, raw",19.84,6.34,0,142,68.5,0
15077,8,"Fish, salmon, chinook, smoked",18.28,4.32,0,117,72,0
15078,8,"Fish, salmon, chinook, raw",19.93,10.43,0,179,71.64,0
15079,8,"Fish, salmon, chum, raw",20.14,3.77,0,120,75.38,0
15080,8,"Fish, salmon, chum, canned, drained solids with bone",21.43,5.5,0,141,70.77,0
15081,8,"Fish, salmon, coho, wild, raw",21.62,5.93,0,146,72.66,0
15082,8,"Fish, salmon, coho, wild, cooked, moist heat",27.36,7.5,0,184,65.39,0
15083,8,"Fish, salmon, pink, raw",20.5,4.4,0,127,75.52,0
15084,8,"Fish, salmon, pink, canned, total can contents",19.68,4.97,0,129,74.04,0
15085,8,"Fish, salmon, sockeye, raw",22.25,4.69,0,131,72.54,0
15086,8,"Fish, salmon, sockeye, cooked, dry heat",26.48,5.57,0,156,67.33,0
15087,8,"Fish, salmon, sockeye, canned, drained solids",23.59,7.39,0,167,68.07,0
15088,8,"Fish, sardine, Atlantic, canned in oil, drained solids with bone",24.62,11.45,0,208,59.61,0
15089,8,"Fish, sardine, Pacific, canned in tomato sauce, drained solids with bone",20.86,10.45,0.54,185,66.86,0.1
15090,8,"Fish, scup, raw",18.88,2.73,0,105,75.37,0
15091,8,"Fish, sea bass, mixed species, raw",18.43,2,0,97,78.27,0
15092,8,"Fish, sea bass, mixed species, cooked, dry heat",23.63,2.56,0,124,72.14,0
15093,8,"Fish, seatrout, mixed species, raw",16.74,3.61,0,104,78.09,0
15094,8,"Fish, shad, american, raw",16.93,13.77,0,197,68.19,0
15095,8,"Fish, shark, mixed species, raw",20.98,4.51,0,130,73.58,0
15096,8,"Fish, shark, mixed species, cooked, batter-dipped and fried",18.62,13.82,6.39,228,60.09,0
15097,8,"Fish, sheepshead, raw",20.21,2.41,0,108,77.97,0
15098,8,"Fish, sheepshead, cooked, dry heat",26.02,1.63,0,126,69.04,0
15099,8,"Fish, smelt, rainbow, raw",17.63,2.42,0,97,78.77,0
15100,8,"Fish, smelt, rainbow, cooked, dry heat",22.6,3.1,0,124,72.79,0
15101,8,"Fish, snapper, mixed species, raw",20.51,1.34,0,100,76.87,0
15102,8,"Fish, snapper, mixed species, cooked, dry heat",26.3,1.72,0,128,70.35,0
15103,8,"Fish, spot, raw",18.51,4.9,0,123,75.95,0
15104,8,"Fish, sturgeon, mixed species, raw",16.14,4.04,0,105,76.55,0
15105,8,"Fish, sturgeon, mixed species, cooked, dry heat",20.7,5.18,0,135,69.94,0
15106,8,"Fish, sturgeon, mixed species, smoked",31.2,4.4,0,173,62.5,0
15107,8,"Fish, sucker, white, raw",16.76,2.32,0,92,79.71,0
15108,8,"Fish, sunfish, pumpkin seed, raw",19.4,0.7,0,89,79.5,0
15109,8,"Fish, surimi",15.18,0.9,6.85,99,76.34,0
15110,8,"Fish, swordfish, raw",19.66,6.65,0,144,73.38,0
15111,8,"Fish, swordfish, cooked, dry heat",23.45,7.93,0,172,68.26,0
15112,8,"Fish, tilefish, raw",17.5,2.31,0,96,78.9,0
15113,8,"Fish, tilefish, cooked, dry heat",24.49,4.69,0,147,70.24,0
15114,8,"Fish, trout, mixed species, raw",20.77,6.61,0,148,71.42,0
15115,8,"Fish, trout, rainbow, wild, raw",20.48,3.46,0,119,71.87,0
15116,8,"Fish, trout, rainbow, wild, cooked, dry heat",22.92,5.82,0,150,70.5,0
15117,8,"Fish, tuna, fresh, bluefin, raw",23.33,4.9,0,144,68.09,0
15118,8,"Fish, tuna, fresh, bluefin, cooked, dry heat",29.91,6.28,0,184,59.09,0
15119,8,"Fish, tuna, light, canned in oil, drained solids",29.13,8.21,0,198,59.83,0
15121,8,"Fish, tuna, light, canned in water, drained solids",19.44,0.96,0,86,78.14,0
15123,8,"Fish, tuna, fresh, skipjack, raw",22,1.01,0,103,70.58,0
15124,8,"Fish, tuna, white, canned in oil, drained solids",26.53,8.08,0,186,64.02,0
15126,8,"Fish, tuna, white, canned in water, drained solids",23.62,2.97,0,128,73.19,0
15127,8,"Fish, tuna, fresh, yellowfin, raw",24.4,0.49,0,109,74.03,0
15128,8,"Fish, tuna salad",16.04,9.26,9.41,187,63.16,0
15129,8,"Fish, turbot, european, raw",16.05,2.95,0,95,76.95,0
15130,8,"Fish, whitefish, mixed species, raw",19.09,5.86,0,134,72.77,0
15131,8,"Fish, whitefish, mixed species, smoked",23.4,0.93,0,108,70.83,0
15132,8,"Fish, whiting, mixed species, raw",18.31,1.31,0,90,80.27,0
15133,8,"Fish, whiting, mixed species, cooked, dry heat",23.48,1.69,0,116,74.71,0
15134,8,"Fish, wolffish, Atlantic, raw",17.5,2.39,0,96,79.9,0
15135,8,"Fish, yellowtail, mixed species, raw",23.14,5.24,0,146,74.52,0
15136,8,"Crustaceans, crab, alaska king, raw",18.29,0.6,0,84,79.57,0
15137,8,"Crustaceans, crab, alaska king, cooked, moist heat",19.35,1.54,0,97,77.55,0
15138,8,"Crustaceans, crab, alaska king, imitation, made from surimi",7.62,0.46,15,95,74.66,0.5
15139,8,"Crustaceans, crab, blue, raw",18.06,1.08,0.04,87,79.02,0
15140,8,"Crustaceans, crab, blue, cooked, moist heat",17.88,0.74,0,83,79.69,0
15141,8,"Crustaceans, crab, blue, canned",17.88,0.74,0,83,79.69,0
15142,8,"Crustaceans, crab, blue, crab cakes, home recipe",20.21,7.52,0.48,155,71,0
15143,8,"Crustaceans, crab, dungeness, raw",17.41,0.97,0.74,86,79.18,0
15144,8,"Crustaceans, crab, queen, raw",18.5,1.18,0,90,80.58,0
15145,8,"Crustaceans, crayfish, mixed species, wild, raw",15.97,0.95,0,77,82.24,0
15146,8,"Crustaceans, crayfish, mixed species, wild, cooked, moist heat",16.77,1.2,0,82,79.37,0
15147,8,"Crustaceans, lobster, northern, raw",16.52,0.75,0,77,80.95,0
15148,8,"Crustaceans, lobster, northern, cooked, moist heat",19,0.86,0,89,78.11,0
15149,8,"Crustaceans, shrimp, mixed species, raw (may have been previously frozen)",13.61,1.01,0.91,71,83.01,0
15150,8,"Crustaceans, shrimp, mixed species, cooked, breaded and fried",21.39,12.28,11.47,242,52.86,0.4
15151,8,"Crustaceans, shrimp, mixed species, cooked, moist heat (may have been previously frozen)",22.78,1.7,1.52,119,71.56,0
15152,8,"Crustaceans, shrimp, mixed species, canned",20.42,1.36,0,100,75.85,0
15153,8,"Crustaceans, shrimp, mixed species, imitation, made from surimi",12.39,1.47,9.13,101,74.91,0
15154,8,"Crustaceans, spiny lobster, mixed species, raw",20.6,1.51,2.43,112,74.07,0
15155,8,"Mollusks, abalone, mixed species, raw",17.1,0.76,6.01,105,74.56,0
15156,8,"Mollusks, abalone, mixed species, cooked, fried",19.63,6.78,11.05,189,60.1,0
15157,8,"Mollusks, clam, mixed species, raw",14.67,0.96,3.57,86,78.98,0
15158,8,"Mollusks, clam, mixed species, cooked, breaded and fried",14.24,11.15,10.33,202,61.55,NULL
15159,8,"Mollusks, clam, mixed species, cooked, moist heat",25.55,1.95,5.13,148,63.64,0
15160,8,"Mollusks, clam, mixed species, canned, drained solids",24.25,1.59,5.9,142,65.26,0
15162,8,"Mollusks, clam, mixed species, canned, liquid",0.4,0.02,0.1,2,97.7,0
15163,8,"Mollusks, cuttlefish, mixed species, raw",16.24,0.7,0.82,79,80.56,0
15164,8,"Mollusks, mussel, blue, raw",11.9,2.24,3.69,86,80.58,0
15165,8,"Mollusks, mussel, blue, cooked, moist heat",23.8,4.48,7.39,172,61.15,0
15166,8,"Mollusks, octopus, common, raw",14.91,1.04,2.2,82,80.25,0
15167,8,"Mollusks, oyster, eastern, wild, raw",5.71,1.71,2.72,51,89.04,0
15168,8,"Mollusks, oyster, eastern, cooked, breaded and fried",8.77,12.58,11.62,199,64.72,NULL
15169,8,"Mollusks, oyster, eastern, wild, cooked, moist heat",11.42,3.42,5.45,102,78.19,0
15170,8,"Mollusks, oyster, eastern, canned",7.06,2.47,3.91,68,85.14,0
15171,8,"Mollusks, oyster, Pacific, raw",9.45,2.3,4.95,81,82.06,0
15172,8,"Mollusks, scallop, mixed species, raw",12.06,0.49,3.18,69,82.53,0
15173,8,"Mollusks, scallop, mixed species, cooked, breaded and fried",18.07,10.94,10.13,216,58.44,NULL
15174,8,"Mollusks, scallop, mixed species, imitation, made from surimi",12.77,0.41,10.62,99,73.82,0
15175,8,"Mollusks, squid, mixed species, raw",15.58,1.38,3.08,92,78.55,0
15176,8,"Mollusks, squid, mixed species, cooked, fried",17.94,7.48,7.79,175,64.54,0
15177,8,"Mollusks, whelk, unspecified, raw",23.84,0.4,7.76,137,66,0
15178,8,"Mollusks, whelk, unspecified, cooked, moist heat",47.68,0.8,15.52,275,32,0
15179,8,"Fish, salmon, chinook, smoked, (lox), regular",18.28,4.32,0,117,72,0
15180,8,"Fish, salmon, chum, canned, without salt, drained solids with bone",21.43,5.5,0,141,70.77,0
15181,8,"Fish, salmon, pink, canned, without salt, solids with bone and liquid",19.78,6.05,0,139,70.03,0
15182,8,"Fish, salmon, sockeye, canned, without salt, drained solids with bone",20.47,7.31,0,153,68.72,0
15183,8,"Fish, tuna, light, canned in oil, without salt, drained solids",29.13,8.21,0,198,59.83,0
15184,8,"Fish, tuna, light, canned in water, without salt, drained solids",25.51,0.82,0,116,75.21,0
15185,8,"Fish, tuna, white, canned in oil, without salt, drained solids",26.53,8.08,0,186,64.02,0
15186,8,"Fish, tuna, white, canned in water, without salt, drained solids",23.62,2.97,0,128,74.02,0
15187,8,"Fish, bass, freshwater, mixed species, cooked, dry heat",24.18,4.73,0,146,68.79,0
15188,8,"Fish, bass, striped, cooked, dry heat",22.73,2.99,0,124,73.36,0
15189,8,"Fish, bluefish, cooked, dry heat",25.69,5.44,0,159,62.64,0
15190,8,"Fish, burbot, cooked, dry heat",24.76,1.04,0,115,73.41,0
15191,8,"Fish, butterfish, cooked, dry heat",22.15,10.28,0,187,66.83,0
15192,8,"Fish, cod, Pacific, cooked, dry heat (may have been previously frozen)",18.73,0.5,0,85,80.31,0
15193,8,"Fish, cusk, cooked, dry heat",24.35,0.88,0,112,69.68,0
15194,8,"Fish, mahimahi, cooked, dry heat",23.72,0.9,0,109,71.22,0
15195,8,"Fish, drum, freshwater, cooked, dry heat",22.49,6.32,0,153,70.94,0
15196,8,"Fish, halibut, greenland, cooked, dry heat",18.42,17.74,0,239,61.88,0
15197,8,"Fish, herring, Pacific, cooked, dry heat",21.01,17.79,0,250,63.49,0
15198,8,"Fish, ling, cooked, dry heat",24.35,0.82,0,111,73.88,0
15199,8,"Fish, lingcod, cooked, dry heat",22.64,1.36,0,109,75.68,0
15200,8,"Fish, mackerel, king, cooked, dry heat",26,2.56,0,134,69.04,0
15201,8,"Fish, mackerel, Pacific and jack, mixed species, cooked, dry heat",25.73,10.12,0,201,61.73,0
15202,8,"Fish, milkfish, cooked, dry heat",26.32,8.63,0,190,62.63,0
15203,8,"Fish, monkfish, cooked, dry heat",18.56,1.95,0,97,78.51,0
15204,8,"Fish, pike, walleye, cooked, dry heat",24.54,1.56,0,119,73.47,0
15205,8,"Fish, pollock, Atlantic, cooked, dry heat",24.92,1.26,0,118,72.03,0
15206,8,"Fish, pout, ocean, cooked, dry heat",21.33,1.17,0,102,76.1,0
15207,8,"Fish, roe, mixed species, cooked, dry heat",28.62,8.23,1.92,204,58.63,0
15208,8,"Fish, sablefish, cooked, dry heat",17.19,19.62,0,250,62.85,0
15209,8,"Fish, salmon, Atlantic, wild, cooked, dry heat",25.44,8.13,0,182,59.62,0
15210,8,"Fish, salmon, chinook, cooked, dry heat",25.72,13.38,0,231,65.6,0
15211,8,"Fish, salmon, chum, cooked, dry heat",25.82,4.83,0,154,68.44,0
15212,8,"Fish, salmon, pink, cooked, dry heat",24.58,5.28,0,153,70.65,0
15213,8,"Fish, scup, cooked, dry heat",24.21,3.5,0,135,68.42,0
15214,8,"Fish, seatrout, mixed species, cooked, dry heat",21.46,4.63,0,133,71.91,0
15215,8,"Fish, shad, american, cooked, dry heat",21.71,17.65,0,252,59.22,0
15216,8,"Fish, spot, cooked, dry heat",23.73,6.28,0,158,69.17,0
15217,8,"Fish, sucker, white, cooked, dry heat",21.49,2.97,0,119,73.99,0
15218,8,"Fish, sunfish, pumpkin seed, cooked, dry heat",24.87,0.9,0,114,73.72,0
15219,8,"Fish, trout, mixed species, cooked, dry heat",26.63,8.47,0,190,63.36,0
15220,8,"Fish, tuna, skipjack, fresh, cooked, dry heat",28.21,1.29,0,132,62.28,0
15221,8,"Fish, tuna, yellowfin, fresh, cooked, dry heat",29.15,0.59,0,130,68.98,0
15222,8,"Fish, turbot, european, cooked, dry heat",20.58,3.78,0,122,70.45,0
15223,8,"Fish, whitefish, mixed species, cooked, dry heat",24.47,7.51,0,172,65.09,0
15224,8,"Fish, wolffish, Atlantic, cooked, dry heat",22.44,3.06,0,123,74.23,0
15225,8,"Fish, yellowtail, mixed species, cooked, dry heat",29.67,6.72,0,187,67.33,0
15226,8,"Crustaceans, crab, dungeness, cooked, moist heat",22.32,1.24,0.95,110,73.31,0
15227,8,"Crustaceans, crab, queen, cooked, moist heat",23.72,1.51,0,115,75.1,0
15228,8,"Crustaceans, spiny lobster, mixed species, cooked, moist heat",26.41,1.94,3.12,143,66.76,0
15229,8,"Mollusks, cuttlefish, mixed species, cooked, moist heat",32.48,1.4,1.64,158,61.12,0
15230,8,"Mollusks, octopus, common, cooked, moist heat",29.82,2.08,4.4,164,60.5,0
15231,8,"Mollusks, oyster, Pacific, cooked, moist heat",18.9,4.6,9.9,163,64.12,0
15232,8,"Fish, roughy, orange, cooked, dry heat",22.64,0.9,0,105,66.97,0
15233,8,"Fish, catfish, channel, wild, cooked, dry heat",18.47,2.85,0,105,77.67,0
15234,8,"Fish, catfish, channel, farmed, raw",15.23,5.94,0,119,79.06,0
15235,8,"Fish, catfish, channel, farmed, cooked, dry heat",18.44,7.19,0,144,74.65,0
15236,8,"Fish, salmon, Atlantic, farmed, raw",20.42,13.42,0,208,64.89,0
15237,8,"Fish, salmon, Atlantic, farmed, cooked, dry heat",22.1,12.35,0,206,64.75,0
15238,8,"Fish, salmon, coho, farmed, raw",21.27,7.67,0,160,70.47,0
15239,8,"Fish, salmon, coho, farmed, cooked, dry heat",24.3,8.23,0,178,67,0
15240,8,"Fish, trout, rainbow, farmed, raw",19.94,6.18,0,141,73.8,0
15241,8,"Fish, trout, rainbow, farmed, cooked, dry heat",23.8,7.38,0,168,68.72,0
15242,8,"Crustaceans, crayfish, mixed species, farmed, raw",14.85,0.97,0,72,84.05,0
15243,8,"Crustaceans, crayfish, mixed species, farmed, cooked, moist heat",17.52,1.3,0,87,80.8,0
